機構名稱,縣市區名,地址,科別
臺北市立聯合醫院附設萬華門診部,臺北市萬華區,臺北市萬華區東園街152號,"家庭醫學科,"
樂群耳鼻喉科家醫科診所,臺北市文山區,臺北市文山區木新路三段202號,"家庭醫學科,耳鼻喉科,"
臺北市立萬芳醫院-委託臺北醫學大學辦理,臺北市文山區,臺北市文山區興隆路三段111號,"家庭醫學科,內科,外科,兒科,婦產科,骨科,神經科,神經外科,泌尿科,耳鼻喉科,眼科,皮膚科,精神科,復健科,麻醉科,放射診斷科,放射腫瘤科,解剖病理科,臨床病理科,核子醫學科,急診醫學科,整形外科,職業醫學科,西醫一般科,牙醫一般科,中醫一般科,"
慈慧內科眼科聯合診所,臺北市文山區,臺北市文山區羅斯福路五段264號,"家庭醫學科,眼科,"
定安診所,臺北市文山區,臺北市文山區景興路165號(實際營業為第一層),"家庭醫學科,"
普仁診所,臺北市文山區,臺北市文山區興隆路四段１７１號,"家庭醫學科,"
王家庭醫學科診所,臺北市文山區,臺北市文山區萬安街9號(實際使用第一層),"家庭醫學科,"
東翰診所,臺北市文山區,臺北市文山區興隆路二段139號,"家庭醫學科,"
泓仁診所,臺北市文山區,臺北市文山區木新路二段２７３號,"家庭醫學科,"
澤文診所,臺北市文山區,臺北市文山區興隆路四段１３３號１樓,"家庭醫學科,"
林正豐診所,臺北市文山區,臺北市文山區保儀路25號,"家庭醫學科,"
景美醫院,臺北市文山區,臺北市文山區羅斯福路六段280號、文山區育英街2巷18號、文山區羅斯福路六段276巷1號1樓、文山區萬慶街18號1樓。,"家庭醫學科,內科,外科,骨科,復健科,麻醉科,放射診斷科,"
仁耀診所,臺北市文山區,臺北市文山區興隆路一段２７３號,"家庭醫學科,"
官世英診所,臺北市文山區,臺北市文山區景興路四十五號,"家庭醫學科,"
順欣診所,臺北市文山區,臺北市文山區木柵路3段112號(實際營業地址：一層、二層),"家庭醫學科,內科,"
佳鴻診所,臺北市文山區,臺北市文山區羅斯福路6段256號1樓,"家庭醫學科,泌尿科,皮膚科,"
